{
  "status": "OK",
  "baseline_scenario_id": "A_baseline",
  "scenarios": [
    {
      "scenario_id": "A_baseline",
      "label": "현재 가격 유지",
      "scenario_status": "OK",
      "results": {
        "mode_a": {
          "status": "OK",
          "per_component": {
            "main": {
              "actual_price_ex_vat": {
                "value": 1000,
                "status": "OK",
                "unit": "KRW"
              },
              "direct_cost_total": {
                "value": 400.0,
                "status": "OK",
                "unit": "KRW"
              },
              "gross_profit": {
                "value": 600.0,
                "status": "OK",
                "unit": "KRW"
              },
              "gross_profit_rate": {
                "value": 0.6,
                "status": "OK",
                "unit": "ratio"
              },
              "variable_cost_total": {
                "value": 100.0,
                "status": "OK",
                "unit": "KRW"
              },
              "contribution_margin": {
                "value": 500.0,
                "status": "OK",
                "unit": "KRW"
              },
              "contribution_margin_rate": {
                "value": 0.5,
                "status": "OK",
                "unit": "ratio"
              }
            }
          },
          "warnings": []
        },
        "mode_b": {
          "status": "OK",
          "per_component": {
            "main": {
              "denominator": {
                "value": 0.7,
                "status": "OK",
                "unit": "ratio"
              },
              "required_net_sales_ex_vat": {
                "value": 714.2857142857143,
                "status": "OK",
                "unit": "KRW"
              },
              "required_gross_payment_incl_vat": {
                "value": 785.7142857142858,
                "status": "OK",
                "unit": "KRW"
              },
              "required_selling_price": {
                "value": 714.2857142857143,
                "status": "OK",
                "unit": "KRW"
              },
              "required_list_price": {
                "value": 714.2857142857143,
                "status": "OK",
                "unit": "KRW"
              },
              "expected_contribution_margin": {
                "value": 214.2857142857143,
                "status": "OK",
                "unit": "KRW"
              },
              "expected_contribution_margin_rate": {
                "value": 0.3,
                "status": "OK",
                "unit": "ratio"
              }
            }
          },
          "warnings": []
        },
        "mode_c": {
          "status": "OK",
          "per_component": {
            "main": {
              "market_net_sales_ex_vat": {
                "value": 1000,
                "status": "OK",
                "unit": "KRW"
              },
              "market_gross_payment_incl_vat": {
                "value": 1100.0,
                "status": "OK",
                "unit": "KRW"
              },
              "allowable_direct_cost": {
                "value": 600.0,
                "status": "OK",
                "unit": "KRW"
              },
              "actual_direct_cost": {
                "value": 400.0,
                "status": "OK",
                "unit": "KRW"
              },
              "direct_cost_gap": {
                "value": 200.0,
                "status": "OK",
                "unit": "KRW"
              },
              "expected_contribution_margin": {
                "value": 300.0,
                "status": "OK",
                "unit": "KRW"
              },
              "expected_contribution_margin_rate": {
                "value": 0.3,
                "status": "OK",
                "unit": "ratio"
              }
            }
          },
          "warnings": []
        },
        "bep": {
          "status": "OK",
          "per_component": {
            "main": {
              "analysis_period_basis": "per_month",
              "contribution_margin_per_unit": {
                "value": 500.0,
                "status": "OK",
                "unit": "KRW"
              },
              "fixed_operating_cost": {
                "value": 50000.0,
                "status": "OK",
                "unit": "KRW"
              },
              "break_even_quantity_exact": {
                "value": 100.0,
                "status": "OK",
                "unit": "units"
              }
            }
          },
          "warnings": []
        }
      },
      "summary": {
        "per_component": {
          "main": {
            "mode_a": {
              "status": "OK",
              "actual_price_ex_vat": {
                "value": 1000,
                "status": "OK",
                "unit": "KRW"
              },
              "contribution_margin": {
                "value": 500.0,
                "status": "OK",
                "unit": "KRW"
              },
              "contribution_margin_rate": {
                "value": 0.5,
                "status": "OK",
                "unit": "ratio"
              }
            },
            "mode_b": {
              "status": "OK",
              "required_selling_price": {
                "value": 714.2857142857143,
                "status": "OK",
                "unit": "KRW"
              },
              "required_list_price": {
                "value": 714.2857142857143,
                "status": "OK",
                "unit": "KRW"
              }
            },
            "mode_c": {
              "status": "OK",
              "allowable_direct_cost": {
                "value": 600.0,
                "status": "OK",
                "unit": "KRW"
              },
              "actual_direct_cost": {
                "value": 400.0,
                "status": "OK",
                "unit": "KRW"
              },
              "direct_cost_gap": {
                "value": 200.0,
                "status": "OK",
                "unit": "KRW"
              }
            },
            "bep": {
              "status": "OK",
              "fixed_operating_cost": {
                "value": 50000.0,
                "status": "OK",
                "unit": "KRW"
              },
              "contribution_margin_per_unit": {
                "value": 500.0,
                "status": "OK",
                "unit": "KRW"
              },
              "break_even_quantity_exact": {
                "value": 100.0,
                "status": "OK",
                "unit": "units"
              },
              "analysis_period_basis": "per_month"
            }
          }
        }
      },
      "warnings": [],
      "deltas": {
        "per_component": {
          "main": {
            "net_sales_ex_vat_delta": {
              "value": 0,
              "status": "OK"
            },
            "contribution_margin_delta": {
              "value": 0.0,
              "status": "OK"
            },
            "contribution_margin_rate_delta": {
              "value": 0.0,
              "status": "OK"
            },
            "break_even_quantity_delta": {
              "value": 0.0,
              "status": "OK"
            }
          }
        }
      }
    },
    {
      "scenario_id": "B_price_up",
      "label": "가격 인상 (1000 -> 1200)",
      "scenario_status": "OK",
      "results": {
        "mode_a": {
          "status": "OK",
          "per_component": {
            "main": {
              "actual_price_ex_vat": {
                "value": 1200,
                "status": "OK",
                "unit": "KRW"
              },
              "direct_cost_total": {
                "value": 400.0,
                "status": "OK",
                "unit": "KRW"
              },
              "gross_profit": {
                "value": 800.0,
                "status": "OK",
                "unit": "KRW"
              },
              "gross_profit_rate": {
                "value": 0.6666666666666666,
                "status": "OK",
                "unit": "ratio"
              },
              "variable_cost_total": {
                "value": 100.0,
                "status": "OK",
                "unit": "KRW"
              },
              "contribution_margin": {
                "value": 700.0,
                "status": "OK",
                "unit": "KRW"
              },
              "contribution_margin_rate": {
                "value": 0.5833333333333334,
                "status": "OK",
                "unit": "ratio"
              }
            }
          },
          "warnings": []
        },
        "mode_b": {
          "status": "OK",
          "per_component": {
            "main": {
              "denominator": {
                "value": 0.7,
                "status": "OK",
                "unit": "ratio"
              },
              "required_net_sales_ex_vat": {
                "value": 714.2857142857143,
                "status": "OK",
                "unit": "KRW"
              },
              "required_gross_payment_incl_vat": {
                "value": 785.7142857142858,
                "status": "OK",
                "unit": "KRW"
              },
              "required_selling_price": {
                "value": 714.2857142857143,
                "status": "OK",
                "unit": "KRW"
              },
              "required_list_price": {
                "value": 714.2857142857143,
                "status": "OK",
                "unit": "KRW"
              },
              "expected_contribution_margin": {
                "value": 214.2857142857143,
                "status": "OK",
                "unit": "KRW"
              },
              "expected_contribution_margin_rate": {
                "value": 0.3,
                "status": "OK",
                "unit": "ratio"
              }
            }
          },
          "warnings": []
        },